{
  "context": {
    "task_id": "task-openvas-xml",
    "run_id": "run-openvas-xml",
    "operator": "fixture-operator",
    "workspace": "fixture-workspace",
    "authorization_scope": "fixture:local-only"
  },
  "target": {"type": "report", "value": "openvas-xml-fixture", "metadata": {}},
  "options": {
    "mode": "fixture",
    "import": {
      "format": "openvas_xml",
      "file": "examples/fixture.xml",
      "max_records": 100,
      "include_log": false,
      "minimum_severity": "low"
    },
    "output": {
      "include_description": true,
      "include_solution": true,
      "include_evidence": true,
      "include_source_details": true
    },
    "execution_profile": "fixture"
  },
  "policy": {"allow_active_verify": false, "allow_high_risk": false}
}
